{
  "request_id": "req_00000001",
  "state_version": 7,
  "provider": {
    "name": "stub",
    "model": "stub-1"
  },
  "status": "ok",
  "proposals": [
    {
      "proposal_id": "prop_00000001",
      "kind": "no_action",
      "rationale": "Отдых.",
      "cites": [],
      "body": {
        "reason": "rest"
      }
    }
  ],
  "explanation": "Решила отдохнуть.",
  "usage": {
    "calls": 1,
    "duration_ms": 900
  },
  "tool_use_detected": false
}
